{"$schema":"https://json-schema.org/draft/2020-12/schema","$id":"urn:edgelab:scheduler-state:1","type":"object","additionalProperties":false,"required":["schema_version","state_id","generation","project_state","stops","tasks","claims","completed_tasks"],"properties":{"schema_version":{"const":1},"state_id":{"const":"M0.2-SYNTHETIC-SCHEDULER"},"generation":{"type":"integer","minimum":1},"project_state":{"type":"object","additionalProperties":false,"required":["ref","sha256"],"properties":{"ref":{"const":"docs/project-state.json"},"sha256":{"type":"string","pattern":"^[a-f0-9]{64}$"}}},"stops":{"type":"array","minItems":1,"uniqueItems":true,"items":{"type":"object","additionalProperties":false,"required":["ref","sha256"],"properties":{"ref":{"type":"string","pattern":"^reports/stops/STOP-M0-001\\.v[0-9]+\\.json$"},"sha256":{"type":"string","pattern":"^[a-f0-9]{64}$"}}}},"tasks":{"type":"object","minProperties":1,"additionalProperties":{"type":"string","pattern":"^orchestration/tasks/T-[A-Z0-9-]+\\.v[0-9]+\\.json$"}},"claims":{"type":"object","minProperties":1,"additionalProperties":{"type":"object","additionalProperties":false,"required":["role","attempt","status","handoff_ref","generation"],"properties":{"role":{"const":"00 Director"},"attempt":{"type":"integer","minimum":1},"status":{"enum":["ACTIVE","RELEASED","CLOSED"]},"handoff_ref":{"type":"string","pattern":"^docs/handoffs/H-M0-028\\.v[0-9]+\\.json$"},"generation":{"type":"integer","minimum":1}}}},"completed_tasks":{"type":"array","uniqueItems":true,"items":{"type":"string","pattern":"^T-[A-Z0-9-]+$"}}}}
